{
  "package.input": [
    ".\\scripts\\initial*.sql",
    ".\\src\\VIEWS\\*.sql",
    ".\\src\\PACKAGES\\*.sql",
    ".\\src\\PACKAGE_BODIES\\*.sql",
    ".\\src\\FUNCTIONS\\*.sql",
    ".\\src\\PROCEDURES\\*.sql",
    ".\\src\\TRIGGERS\\*.sql",
    ".\\scripts\\final*.sql",
    "!.\\**\\*EXCLUDE*.sql"
  ],
  "package.output": ".\\deploy\\Run.sql",
  "package.encoding": "utf8",
  "package.templating": false,
  "source": [
    ".\\src\\**\\*.sql"
  ],
  "compile.warnings": "NONE",
  "compile.force": false,
  "version.number": "develop",
  "version.description": "develop",
  "version.releaseDate": "1899-01-01",
  "test.input": [
    ".\\test\\**\\*.test.sql"
  ]
}
